{
  "$schema": "http://json-schema.org/draft-07/schema#",
  "title": "Dokufy Enterprise Cloud Agreement Input",
  "type": "object",
  "properties": {
    "provider": { "type": "string" },
    "client": { "type": "string" },
    "contractNumber": { "type": "string" },
    "effectiveDate": { "type": "string" },
    "term": { "type": "string" },
    "parties": { "type": "array" },
    "sla": { "type": "array" },
    "clauses": { "type": "array" },
    "signatures": { "type": "array" }
  },
  "required": ["provider", "client", "contractNumber"]
}